id,version,url,title,salary_from,salary_to,experience_from,experience_to,description,company_id,source_id,vector,publicated_at
119,1,https://rabota.sber.ru/search/4175204,Team Lead ETL,,,,,"Разрабатываем мощный инструмент передачи данных в пакетном и потоковом режиме (NRT) из крупнейшего источника объемом более 100+ петабайт в современные системы обработки данных на базе Hadoop, Oracle, GreenPlum, PostgreSQL, Kafka и др.Объединяем вместе все передовые инструменты для обеспечения поставки данных и упрощения процесса построения Data-продуктов (Аналитика, системы принятия решений, Next Best Action, AI и пр.)
Сервис построен на базе лучших промышленных ETL-инструментов максимально обеспечивающих все предъявляемые требования и характеристики для систем передачи данных. Гибкий механизм рекурсивной автогенерации и широкий перечень интеграционных процессов исполняется на собственных кластерных мощностях в полном цикле CI/CD жизни производственного процесса
Обязанности
Формирование видения продукта и построение детальных планов по его реализации
Организация работы команды
Управление бэклогом
Коммуникации со смежными командами по вопросам формирования общего бэклога и решения проблем
Ведение ключевых метрик по продукту
Проведение демо продукта для заказчиков и потребителей
Подбор новых кадров в команду
Требования
Опыт успешной реализации технологических продуктов
Понимание механизмов работы базовых технологий BigData
Умение ведения уверенных коммуникаций и переговоров с контрагентами
Знание мировых трендов в области построения интеграционных процессов на больших объемах данных будет плюсом
Условия
·  Режим работы: 5/2, возможен гибридный режим после 3х месяцев работы
Офис Новоданиловская набережная 10. БЦ ""Даниловский форт""
Отсутствие строгого дресс-кода
Уровень заработной платы, который зависит от ваших технических знаний и навыков, состоит из оклада и годового премирования
Премирование: годовое, с учетом результатов работы команды
Социальный пакет: ДМС, спортзал, страхование жизни, возможность обучаться за счет компании, посещение корпоративного санатория в Крыму одному или с семьей
Если вам нравится идея превратить «главный» банк России в передовую сервисную экосистему, будем рады увидеть вас в команде!",0,https://rabota.sber.ru/search,0,2023-10-20
120,1,https://rabota.sber.ru/search/4191306,Senior Data Analyst (Департамент по работе с проблемными активами),,,,,"В команду Data Science ищем эксперта по работе с аналиткой. Мы отлично разрабатываем DS модели и понимаем, что в реальном процессе они могут применяться лучше и приносить больше пользы. Наш будущий коллега поможет нам доказать это на практике. Наши решения уже принесли миллиарды эффектов, но мы уверены, что это только начало!
Обязанности
Перед командой стоят следующие вызовы:
- Применение ML для оптимизации бизнесс процессов и получения эффектов
- Прогнозные, оптимизационные и причинно-следственные модели
- Аудио аналитика телефонных разговоров и записей взаимодействия с клиентами
- Гео аналитика эффективности работы подразделения и отдельных сотрудников
- Анализ цифровых следов клиентов и поиск узких мест в процессах (process mining)
Требования
От будущего коллеги ждем:

- Регулярная и ad-hoc аналитика по поиску точек роста, проверке гипотез и оптимизации бизнес-процессов
- Визуализация данных и подготовка презентаций для обоснвания изменений, защита результатов исследования
- Встраивание результатов ML моделей в бизнесс процесс, пересмотр процесса с учетом специфики использования моделей
- Проведение тестирований гипотез, визуализация план-факторного анализа, расчет ключевых метрик, маркировка отклонений
Навыки, необходимые для выполнения описанных обязанностей, включая:
- Python (pandas, numpy, spark, matplot)
- Ехсеl - продвинутые пользователь
- Хорошее знание SQL, опыт написания сложных запросов
- Приветствуется опыт построения дашбордов Qlik, Tableau, Grafana и т д
Условия
Условия
· Трудоустройство согласно ТК РФ
· Регулярное корпоративное обучение
· ДМС, страхование от несчастных случаев и тяжелых заболеваний
· Материальная помощь и социальная поддержка, корпоративная пенсионная программа
· Льготные условия кредитования.",0,https://rabota.sber.ru/search,0,2023-11-02
121,1,https://rabota.sber.ru/search/4220251,Аналитик данных в Департамент по работе с проблемными активами,,,,,"В команду Data Science ищем эксперта по работе с аналиткой. Мы отлично разрабатываем DS модели и понимаем, что в реальном процессе они могут применяться лучше и приносить больше пользы. Наш будущий коллега поможет нам доказать это на практике. Наши решения уже принесли миллиарды эффектов, но мы уверены, что это только начало!
Обязанности
Перед командой стоят следующие вызовы:
- Применение ML для оптимизации бизнесс процессов и получения эффектов
- Прогнозные, оптимизационные и причинно-следственные модели
- Аудио аналитика телефонных разговоров и записей взаимодействия с клиентами
- Гео аналитика эффективности работы подразделения и отдельных сотрудников
- Анализ цифровых следов клиентов и поиск узких мест в процессах (process mining)
Требования
От будущего коллеги ждем:

- Регулярная и ad-hoc аналитика по поиску точек роста, проверке гипотез и оптимизации бизнес-процессов
- Визуализация данных и подготовка презентаций для обоснвания изменений, защита результатов исследования
- Встраивание результатов ML моделей в бизнесс процесс, пересмотр процесса с учетом специфики использования моделей
- Проведение тестирований гипотез, визуализация план-факторного анализа, расчет ключевых метрик, маркировка отклонений
Навыки, необходимые для выполнения описанных обязанностей, включая:
- Python (pandas, numpy, spark, matplot)
- Ехсеl - продвинутые пользователь
- Хорошее знание SQL, опыт написания сложных запросов
- Приветствуется опыт построения дашбордов Qlik, Tableau, Grafana и т д
Условия
Условия
· Трудоустройство согласно ТК РФ
· Регулярное корпоративное обучение
· ДМС, страхование от несчастных случаев и тяжелых заболеваний
· Материальная помощь и социальная поддержка, корпоративная пенсионная программа
· Льготные условия кредитования.",0,https://rabota.sber.ru/search,0,2023-10-25
122,1,https://rabota.sber.ru/search/4226433,Data-аналитик,,,,,"Наша команда исследует инновационные подходы к персонализации предложений под клиента. В команде есть несколько направлений работ. Первое направление -персонализация предложения под клиента (ласково называем «Ромашка»). Это поиск знания о жизненных ситуациях и потребностях клиентов, способах их определения по цифровым следам клиента в банке и ДЗО, способах помочь клиенту решить его потребности с помощью продуктов и сервисов экосистемы Сбера. Второе направление – AI генерация гипер-персонализированного контента (текста и изображений) для каждого розничного клиента банка. Задача - повысить эффективность коммуникаций за счет персонализации контента по клиента с учётом знаний о нём.

Кого мы ищем?
Data-аналитика с готовностью включаться в менеджерские процессы.
Обязанности
анализ данных по клиентам/ запускаемым кампаниям поиск и проверка гипотез на данных оценка потенциальных эффектов от AI определение приоритетных направлений развития
взаимодействие с другими командами, мониторинг проведения пилотных рекламных кампаний (А/Б тестов) с применением AI-моделями команды
подведение итогов пилотов, мониторинг метрик, оценка эффектов, формирование предложений по направлению работ
подготовка презентационных материал, визуализация отчетности по пилотам, процессам, метрикам для команд B2C и руководства
оценка точности разработанных моделей
учёт моделей их версий, описание методологии работы с ними, мониторинг соблюдения методологии в кампаниях (описание, документирование)
помощь в создании наборов данных для обучения AI моделей.
Требования
высшее образование: техническое или экономическое
опыт работы в качестве бизнес-аналитика от 2 лет
уверенное знание SQL (оконные функции, cte-запросы, умение читать план запроса и т.д.)
уверенное знание Excel и знание Power Point
понимание ключевых понятий экономики продукта для оценки финансового эффекта от проводимых кампаний: PL, ставка дисконтирования, ставка маржи и т.д. знание метрик: NPV, IRR, CR, CTR, ROI, MAU и пр.
умение анализировать бизнес-потребность и AI-модели, критиковать их и продумывать более оптимальные варианты
умение работать со смежными командами, отстаивать интересы по своим задачам и место в бэклоге, контролировать выполнение поставленных задач.

Преимуществом будет:
знание python
опыт работы с Hadoop, Spark
опыт постановки задач (бизнес-требований) к программным продуктам
понимание банковских процессов, принципов подготовки и проведения рекламных кампаний и А/Б-исследований
опыт работы с AI-проектами, опыт написания промптов в текстовые генеративные модели (ChatGPT, GigaChat и пр.), опыт генерации изображений (midjorney, stable diffusion, kandinsky).
Условия
команда профессионалов, готовых поддержать ваши инициативы
возможность работы с новыми технологиями
обучение за счёт компании
гибкий график
красивый и комфортный офис по адресу г. Москва Кутузовский пр-т 32
ДМС
прозрачная система бонусов и премий, достойная зарплата — размер обсудим на собеседовании.",0,https://rabota.sber.ru/search,0,2023-11-08
123,1,https://rabota.sber.ru/search/4223080,Разработчик СУБД (Feature Store),,,,,"Мы ищем разработчика СУБД в новую команду для создания инструмента – «Feature Store». Инструмент должен значительно облегчить жизнь DE/DS и ускорить T2M по разработке и выводу в промышленную эксплуатацию новых моделей.
Обязанности
создание back части «Магазина Фичей» для DS Блока Риски
разработка БД с метаданными фичей(таблицы, атрибуты, связи, правила соединения)
совместно с аналитиком разработка физической модели для хранения метаданных
оптимизация производительности БД
написание хранимых процедур, функций, API под БД PostgreSQL
разработка микросервисов для интеграции c front (WEB UI), другими инструментами платформы.
Требования
высшее техническое образование.
опыт в качестве backend-разработчика (API, PostgreSQL, Rest) не менее 2 лет
опыт разработки хранилищ данных или отчетных БД
понимание основных подходов в построении микросервисной архитектуры: интеграции БД с потребителями, создания rest методов и т.д.
базовые знания теории баз данных (нормальные формы, кардинальности связей и т.п.)
отличное знание SQL, PL/SQL (желательно в СУБД Postgres)
навыки в оптимизация производительности. Умение разобрать план запроса, переписать, предложить другую физическую реализацию объектов БД, если необходимо
опыт работы с форматами JSON, YML. Генерация, парсинг, создание API для обработки
опыт работы с форматами JSON, YML. Генерация, парсинг
опыт разработки API для Postgres на Java
умение документировать свой код
опыт построения DevOps pipeline, раскатка по средам, подключение модулей. Jenkins, Ansible, Git, Jira.
Будет плюсом:
опыт работы с Hadoop, знания архитектуры
знание и умение работы с wiki-системой Confluence, трекинговыми системами (Jira, Redmine и т.д.).
Условия
реально дружный коллектив, постоянный «движ»
работу в передовом секторе IT крупнейшей компании, решение масштабных задач
работу в современном комфортном офисе
премирование по итогам года
социальный пакет + ДМС (с возможностью расширения пакета для близких)
льготную ипотечную программу (после 6 месяцев работы в Сбере)
отличную программу софинансирования пенсионных накоплений
широкий спектр дисконт-программ, скидок и привилегий от компаний-партнеров.
безбумажный офис.",0,https://rabota.sber.ru/search,0,2023-10-24
124,1,https://rabota.sber.ru/search/4209793,Бизнес-аналитик\ Аналитик данных,,,,,"Мы находимся в поиске Бизнес\ Data аналитика по направлению Лидогенерации для банковских продуктов, небанковских сервисов и продуктов Экосистемы Сбера
Наша цель - удовлетворить потребности клиентов за счет своевременного предложения Банковских продуктов и продуктов Экосистемы. Наша команда работает над продуктовым процессом с момента поиска потребности клиента до передачи предложения в канал продвижения и получения дохода от реализации продукта, используя информацию из всех аналитических хранилищ банка. Наши инструменты помогают эффективно управлять перекрестными продажами, удерживать существующих клиентов и находить новых, повышая доходность клиентской базы и окупаемость инвестиций в маркетинг.

Мы формируем гипотезы, делаем анализ о способах подтверждения, производим прототипирование, пилотируем гипотезы, подводим итоги, автоматизируем в промышленных инструментах, оказываем RUN поддержку и контролируем качество.
Обязанности
разработка кампаний продаж на стеке Python и Greenplum
написание и оптимизация SQL запросов
рродуктовая аналитика, проведение A/B тестов
подведение итогов запущенных кампаний продаж, анализ эффективности
поиск и проверка инсайтов по продажам
Требования
уверенное знание SQL, Python
опыт в области бизнес-анализа и/или построения отчетности
Будет плюсом:

опыт работы c знание BitBucket, Jenkins
опыт работы с ETL-инструментами (например, AirFlow)
знание банковских продуктов корпоративного бизнеса
базовые знания современных тенденций на рынке AI-технологий
Условия
офис «Sbergile Home» рядом с м. Кутузовская
стабильный оклад и социальную поддержку сотрудников
официальное оформление с первого дня
современный офис с зонами отдыха и спортзалом
расширенный ДМС с первого дня и льготное страхование для близких
корпоративное обучение в Виртуальной школе Сбера
бесплатную подписку СберПрайм+ и скидки на продукты компаний-партнеров
корпоративную пенсионную программу
ипотеку выгоднее до 4% для каждого сотрудника.",0,https://rabota.sber.ru/search,0,2023-10-13
