id,version,url,title,salary_from,salary_to,experience_from,experience_to,description,company_id,source_id,vector,publicated_at
170,1,https://rabota.sber.ru/search/4226308,Java разработчик (Platform V Corax),,,,,"О проекте:
Мы - команда разработки Platform V Corax, решении основанном на Apache Kafka.
Для пользователей Platform V Corax мы делаем доработки, от простых hotfix'ов до сложных технологических фичей.
Мы расширяемся и ищем в команду Senior Software Developer (направление Core).
Вашими задачами будут:
Разработка новых фичей внутри форка Apache Kafka и их перенос в upstream.
Разработка новый модулей и утилит для Corax.
Исправление багов Kafka.
Написание unit, интеграционных тестов для разработанной функциональности.

Примеры задач:

Разработка подсистемы аудита в Apache Kafka.
Добавление метрики consumer lag на брокере. Метрика позволяет вычислить lag чтения каждой consumer group'ы.
Разработка расширенная система квот на топики.
Разработка альтернативной реализации schema registry. Поддержка схем avro, protobuf, json, xml.
Модуль шифрования паролей в конфиге Apache Kafka.
Разбор и исправление сoncurrency баги в Apache Kafka.
Что мы от вас ожидаем:
Знание алгоритмов и структур данных.
Опыт работы с concurrency и нагруженными сервисами от 1 года.
Понимание принципов работы брокеров очередей и баз данных (запросы, транзакции, реплики).
Опыт разработки на Java.
Базовое знание Linux.
Английский язык на уровне чтения технической документации и переписки.

Плюсом будет(пункты ниже опциональные):

Опыт многопоточного программирования.
Участие в разработке или тестировании распределенных систем или баз данных.
Опыт разработки на Scala или желание выучить этот ЯП.
Вклад в opensource проекты.
Что мы предлагаем:
Работа в команде высококлассных профессионалов, у которых есть чему научиться. Ребята из команды регулярно выступают на конференциях уровня HL++
Возможность получить реальный опыт области многопоточного программирования и распределенных систем
Очень хорошие условия труда (белая заработная плата, оклад, премии).
Мы всячески приветствуем и поддерживаем сотрудников в выступлениях на конференциях, вебинарах, митапах: у нас (по желанию) Вы сможете обучиться азам ораторского мастерства, попробовать (или продолжить прокачивать) себя в роли спикера и повысить свою репутацию в профессиональных кругах.

Приятные мелочи:

График работы - стандартный, но гибкий, с учетом персонального ритма жизни
Комфортный офис со спортзалом, кафе для сотрудников
ДМС (включая стоматологию), страхование, фитнес (в зависимости от территории).",0,https://rabota.sber.ru/search,0,2023-11-07
171,1,https://rabota.sber.ru/search/4196710,Senior Java Developer,,,,,"Общество с ограниченной ответственностью Страховая компания «Сбербанк cтрахование» основано в 2014 году.
Единственным участником Общества и владельцем 100% долей в его уставном капитале является ПАО Сбербанк.
Приглашаем Senior Java Developer в команду Сбербанк Страхования!
Современные технологии и подходы к организации работы. Профессиональная команда. Интересные задачи и ценный опыт.
Обязанности
Доработка системы документооборота (СЭД) - Система разработана на платформе CUBA (JMIX), которая в свою очередь в своем ядре строится на Spring. Доработки производятся непосредственно с использованием фреймворка платформы СUBA (JMIX), а не «чистого» Spring
Разработка сервисов и компонентов СЭД, интеграций с другими системами (REST, SOAP)
Взаимодействие с другими участниками процесса разработки, консультация аналитиков при составлении требований к разработке
Распределение задач между другими разработчиками системы в команде, парное программирование
Знание стандартов разработки и контроль качества кода в команде
Участие в принятии архитектурных решений
Умение работать по методологии Scrum, оценивать задачи и планировать двухнедельный спринт.
Требования
Опыт промышленной разработки от 3-х лет (желательно опыт разработки СЭД-систем)
Уверенное знание Java Core (8+), плюсом будут знания по Spring/Spring Boot, Vaadin
Docker, SOLID, паттерны проектирования, ООП
Опыт разработки REST и SOAP сервисов, XML (XSD), JSON, паттерны интеграции
Опыт работ с промышленными СУБД (SQL,Oracle, PostgreSQL)
Владение инструментами, нацеленными на тестирование: JMeter, JUnit, Mockito, AssertJ
Желателен опыт JavaScript и основы верстки
Владение инструментами ведения разработки: GIT, IntelliJ, SqlDeveloper, Docker, SoapUi, JIRA, Confluence
Понимание принципов и готовность работать по Agile.
Условия
Гибридный формат работы (современный офис в Москве, м.Проспект Мира)
Льготные ипотечные условия кредитования
Бесплатная подписка СберПрайм+, скидки на продукты компаний-партнеров: Okko, Сбер Маркет, Мега Маркет, Самокат, Еаптека и другие
ДМС с первого дня и скидки на страхование для близких
Корпоративная пенсионная программа
Детский отдых и подарки за счет Компании
Обучение за счет Компании: онлайн курсы, неограниченный доступ к библиотеке и обучение на базе Корпоративного университета**,** ** тренинги, митапы и возможность получить новую квалификацию**
Скидки на отдых в курортном комплексе «Mriya Resort & SPA» в Ялте.",0,https://rabota.sber.ru/search,0,2023-10-26
172,1,https://rabota.sber.ru/search/4197544,Главный инженер по ИТ сопровождению,,,,,"Приглашаем к нам команду сопровождения бизнес-приложений прикладного администратора.
Современные технологии и подходы к организации работы. Профессиональная команда. Интересные задачи и ценный опыт.
Обязанности
2я линия сопровождения автоматизированных систем
Проведение первичного анализа причин возникновения ошибок, при необходимости передача их внутренним и внешним разработчикам
Анализ логов систем (ELK), использование простых запросов в БД (Oracle) для поиска и устранения ошибок
Разбор ошибок интеграции между системами
Создание, изменение, блокировка учетных записей описанных систем, управление ролевой моделью
Актуализация справочников
Оказание консультаций пользователям по своей зоне ответственности
Взаимодействие с технической поддержкой подрядных организаций, с аналитиками, разработчиками
Актуализация базы знаний (Confluence), написание инструкций, отчетов.
Требования
Высшее образование
Опыт работы в технической поддержке пользователей от 2х лет
Самостоятельность, инициативность
Знание основ языка SQL и работы СУБД
Знание структуры XML, инструментов работы с XML
Понимание архитектуры и принципов работы корпоративных информационных систем, веб-сервисов, интеграций
Знание Postman, XMLSpy, SQL Developer или аналогов
Опыт работы с Jira/Confluence/системами Service desk
Знание основ ITIL и автоматизации ИТ процессов
Опыт работы в страховании является плюсом.
Условия
Работа в гибридном формате - удаленно и в современном новом офисе
Современная ИТ инфраструктура и используемые технологии
Дружная профессиональная команда
Интересные задачи любого уровня сложности
Динамичная и гибкая рабочая среда
Достойная зарплата и премии
Доступ к каталогу обучающих курсов СберУниверситета
Полис ДМС с отличными условиями
Скидки и льготные условия по предложениям компаний группы Сбер и партнерам.",0,https://rabota.sber.ru/search,0,2023-11-01
173,1,https://rabota.sber.ru/search/4226119,Системный аналитик OPS (Рекламная платформа),,,,,"Мы - новая быстрорастущая команда, создающая сервис, который будет управлять цифровыми рекламными поверхностями и платформой по размещению рекламы на поверхностях Банка и Экосистемы.

Используя данные СБЕРа и технологические решения его экосистемы, мы сможем реализовать уникальный сервис на рынке digital marketing. Он позволит нам показывать пользователям рекламу, которая будет нравиться и которая будет делать рекламные продукты эффективными и измеримыми для рекламодателей.

Если вы талантливый и амбициозный специалист в сфере ИТ, если вы хотите быть причастными к созданию лучших продуктов для лучших клиентов и уверенно отвечать за результаты, то мы рады принять вас в команду.
Обязанности
участие в разработке и защите архитектуры сервисов высоконагруженной реалтаймовой рекламной платформы
формирование функциональных и технических требований к инфраструктуре, к Infrastructure-as-Code, к devops практикам
управление проектами по созданию и развитию ключевых сервисов платформы - участие в планировании этапов проектов, постановка задач, контроль сроков выполнения.
Требования
опыт работы devops/sysops
опыт работы системным аналитиком, менеджером по продукту или техническим менеджером в области веб-приложений и высоконагруженных сервисов
опыт поиска узких мест в архитектуре
опыт выстраивания системы мониторинга
опыт работы по гибким методологиям разработки, опыт организации и координации работы devops, тестирования
умение работать с большим потоком информации от большого числа смежных команд и платформ
коммуникабельность, умение ставить и объяснять задачи разработчикам
отличные навыки работы с данными – БД (clickhouse, sql)
владение инструментами аналитика: ПО проектирование макетов/мокапов, инструментов тестирования API, jira/confluence
Условия
интересные задачи по продуктам, влияющим одновременно на всю Экосистему: мы пишем продукты с 0, а значит никакого legacy и свобода творчества
команда специалистов из топовых ИТ компаний
регулярное обучение и профильные конференции, современное оборудование для работы
уровень дохода, который готовы обсуждать и отталкиваться от ваших пожеланий, плюс премии
комфортный офис и гибкий график
множество плюшек от Сбера.",0,https://rabota.sber.ru/search,0,2023-11-02
174,1,https://rabota.sber.ru/search/4218097,Аналитик схемотехник,,,,,"Наша команда повышает комфорт и качество жизни людей, используя возможности технологий интернета вещей
Связав между собой разные устройства: гаджеты, бытовые приборы, датчики, за счет использования их внутренних или облачных вычислительных мощностей, программного обеспечения и возможности обмена информацией, мы управляем работой этих устройств, как единым механизмом. Это упрощает рутину, а также делает комфортнее наш отдых, например, когда мы слушаем музыку или смотрим фильмы.
Обязанности
Разработка электронных схем и трассировка печатных плат в Altium designer
Настройка, отладка и проведение испытаний прототипов, опытных образцов
Разработка ПО на языках C/C++ для первоначального тестирования устройств
Участвовать в разработке устройств
Требования
Профессиональные навыки:

Профильное техническое образование в области проектирования или технологии (электроника и приборостроение, системы автоматизации).
Опыт ведения исследовательской работы
Базовые знания языков программирования С, Python.
Понимание принципов работы и разработки систем автоматизации на базе микроконтроллеров ESP, ATMEGA, STM, их подключение к периферии. Опыт программирования и отладки прошивок (среды Eclipse, STMCube IDE, Arduino IDE).
Желателен опыт инженерной работы, практики реализации собственных DIY проектов с использованием автоматизации (микроконтроллеры).
Наличие навыков работы со средами математического моделирования Matlab/Octave, понимание основ цифровой обработки сигналов – ресэмплирование, фильтрация, преобразование Фурье и т.д.
Знание английского языка на уровне возможности чтения технической литературы.
Личные качества:

Тип темперамента – флегматик (склонность к спокойной длительной работе с небольшим количеством коммуникаций)
Аккуратность.
Условия
Дружный и высококвалифицированный коллектив
Гибкий график
Конкурентный уровень заработной платы, а также годовые премии по результатам работы
Современные рабочие места и программное обеспечение
ДМС, корпоративная пенсионная программа, страхование от несчастных случаев, социальные гарантии, корпоративные мероприятия
Комфортный офис Sbergile Home c лаунж зонами, кафе, рестораном и оборудованными кухнями
Современный спортзал",0,https://rabota.sber.ru/search,0,2023-10-17
