id,version,url,title,salary_from,salary_to,experience_from,experience_to,description,company_id,source_id,vector,publicated_at
57,1,https://rabota.sber.ru/search/4211524,Project Manager Sber AI Lab,,,,,"Ищу менеджера проектов по управлению исследовательскими Data Science проектами в области искусственного интеллекта (анализ данных, машинное обучение).
Обязанности
Взаимодействие с исследовательской группой, систематизация их исследований
Организация и выстраивание процессов управления командой: целеполагание, планирование и каскадирование проектов бэклога исследований по целям, систематизация процессов ведения исследования и результатов, контроль сроков, отчетность
Управление пулом инфраструктуры и вычислительных мощностей команды (сбор потребностей, контроль эксплуатации в пределах команды)
Контроль пайплайна исследований, отчётная работа
Управление бюджетами проектов
Оценка и учет рисков, препятствующих выполнению целей команды.
Превращение исследований в прототипы продуктов, MVP, формирование стратегии продвижения продукта
Требования
Опыт управления проектами, предпочтительно - разработки ПО в области ИТ-, телекома, банкинга в бизнесе, финансах.
Владение инструментами проектного управления: Microsoft Project, Trello, Jira совместной разработки и их аналогов: Wiki (Conflence и аналоги), GitHub, BitBucket.
Знание стандартов проектного управления РМВОК, CRISP-DM, принципов Agile, Scrum и умение их совмещать и применять к исследовательским проектам
Понимание современных принципов управления продуктами: подготовка питчей,
Опыт работы с корпоративной коммуникацией
Опыт участия в международных исследовательских проектах
Опыт работы в стартапах или в перспективных R&D подразделениях с запуском продуктов на технологических рынках


· Будет плюсом:

Опыт реализации проектов в области ИИ, разработка продуктов на основе ИИ, участие в хакатонах, акселерационных программах, подготовка питчей и опыт привлечения инвестиционных средств в продукт
Знание аспектов охраны интеллектуальной собственности, работы с персональными данными.
Условия
Уникальные масштабные проекты, работа в приоритетном направлении,
Достойная заработная плата (оклад + годовая премии)
Современные рабочие места и программное обеспечение
ДМС, корпоративная пенсионная программа, страхование от несчастных случаев, социальные гарантии, корпоративные мероприятия
Дружный и высококвалифицированный коллектив
Комфортный офис Sbergile Home с оупенспейсами, лаунж зонами, кафе, рестораном и оборудованными кухнями
Современный спортзал
Гибридный график (офис + удаленка)",0,https://rabota.sber.ru/search,0,2023-10-23
58,1,https://rabota.sber.ru/search/4227591,Разработчик приложения корпоративной аналитической платформы,,,,,"Мы занимаемся разработкой и внедрением корпоративной биллинговой платформы и ищем талантливого разработчика приложений, который будет ответственным за создание и поддержку нашего приложения для корпоративной аналитической платформы.
Обязанности
Разработка витрин данных и приложения для работы с репликой (Hadoop hive)
Разработка и поддержка процессов загрузки данных из хранилища данных
Организация внедрения и подготовка сопроводительной документации
Координация с участниками интеграционного взаимодействия
Участие в этапах релизного цикла разработки, тестирования (ИФТ, ПСИ, HT) и внедрения
Требования
Уверенное владение SQL (Postgress) на уровне написания сложных скриптов с использованием аналитических функций
Обязательный опыт работы с Hadoop
Знание подходов к оптимизации при работе с данными
Желателен опыт работы с решениями ETL / Data Warehouse
Условия
Офис: Южный порт, м.Кожуховская / МЦК Дубровка со всеми удобствами: столовая, кафе, кухни с холодильниками и кофемашинами
Бесплатный спортзал и бассейн
Достойная заработная плата (оклад + премии)
Гибридный режим работы
Гибкое начало рабочего дня
ДМС с первого дня работы
Бонус за реферальную программу
Возможность обучения и сертификации за счет компании
Льготное кредитование в Сбербанке и дисконт-программы от компаний партнеров.",0,https://rabota.sber.ru/search,0,2023-11-09
59,1,https://rabota.sber.ru/search/4183789,Продуктовый аналитик,,,,,"Мы занимаемся развитием продуктовой аналитики по операциям на глобальных рынках. Ежедневно мы имеем дело с более чем миллионом транзакций клиентов, следим за поведением клиентов на сайте, мобильном приложении, физических отделениях. На основе Data-аналитики оцениваем возможности запуска новых продуктовых фич, проводим A/B-тесты, делаем глубокие аналитические исследования. Развитием Data-аналитики занимается дружная и профессиональная команда из 5 человек, четко выстроены процессы взаимодействия с заказчиками и поддержкой и сопровождением, продуктового контроля и др.
Обязанности
Работа с базами данных, поиск и анализ источников данных, участие в интеграционных задачах
Анализ использования клиентами продуктов банка по всем каналах взаимодействия (сайт, мобильное приложение, физическое отделение, голосовой ассистент)
Создание глубокой аналитики по закрепленным продуктам: расчёт бизнес-кейсов от внедрения новых фич в продукте, аналитика по запускаемым фичам, отслеживание фин. эффектов
Разработка и создание дэшбордов по закрепленным продуктам
Поиск инсайдов и выявление проблемных мест в продуктах на основе данных

Используемые технологии:
· Greenplum
· OLAP-кубы
· MS SQL
· BI (QlickSense, Tablo)
· R/Python
· Google Analytics/Яндекс.Метрика
Требования
 Высшее образование (ИТ/техническое/математическое/экономико-математическое)
Знание математической статистики, методов анализа данных
Навыки написания сложных SQL-запросов (работа с динамическими запросами, оптимизация кода, чтение плана запроса)
Опыт работы в одной из нескольких СУБД: Greenplum/Teradata/MS SQL
Опыт работы с Python или R
Опыт работы с Google Analytics/Яндекс.Метрика
Опыт работы по данному направлению от 2 лет
Знание основных банковских процессов и продуктов приветствуется
Проактивность, аналитическое мышление, желание развиваться и обучаться.
Условия
Стабильный оклад и социальную поддержку сотрудников
Официальное оформление с первого дня
Современный офис с зонами отдыха и спортзалом
Расширенный ДМС с первого дня и льготное страхование для близких
Корпоративное обучение в Виртуальной школе Сбера, регулярные внутренние и внешние митапы
Бесплатную подписку СберПрайм+ и скидки на продукты компаний-партнеров
Корпоративную пенсионную программу
Ипотеку выгоднее до 4% для каждого сотрудника",0,https://rabota.sber.ru/search,0,2023-11-02
60,1,https://rabota.sber.ru/search/4222170,Руководитель направления по стратегии и бенчмаркингу,,,,,"Ищем сотрудника в команду «Стратегия и консалтинг» в Юнит Data (департамент занимающийся персональными предложениями, рекомендательными системами, Единым профилем клиента СБЕРа и многим другим)
Обязанности
подготовка материалов к ключевым активностям на уровне топ-менеджмента СБЕРа
самостоятельный поиск рыночных бенчмарков
организация и проведение исследований с подрядчиками для задач Департамента
разработка стратегий департамента и направлений
Требования
опыт работы в стратегическом консалтинге или аналогичной области
высокий уровень самоорганизации и проактивность
желание разбираться в новом и развиваться
продвинутые навыки анализа и синтезирования информации из внешних и внутренних источников
продвинутый навык подготовки презентации в Power Point, e2e: от концепции и сторилайна до визулизации и дизайна
отличные навыки коммуникации и умение добиваться от коллег желаемого результата
знание/понимание принципов работы рекомендательных систем, CVM, AI-трендов в этой области
знакомство с финансовой отраслью будет преимуществом
готовность к работе в многозадачном режиме
Условия
офис на м. Кутузовская (гибридный режим работы)
интересные, сложные, амбициозные задачи
возможность профильного обучения (обучение и сертификация за счёт компании)
профессиональный рост в молодой и сильной команде
льготные условия по кредитам СберБанка
ДМС, страхование от несчастных случаев, социальные гарантии, корпоративные мероприятия
тренажёрный зал.",0,https://rabota.sber.ru/search,0,2023-10-25
61,1,https://rabota.sber.ru/search/4184091,Senior Data Scientist,,,,,"В DS команду операционного центра ищем Data Scientist.
Что делаем:
Оптимизируем работу бэк-офиса Сбербанка. Анализируем что можно сделать лучше/быстрее/с меньшим кол-вом ошибок.
Обязанности
Анализ процессов, проведение R&D, и внедрение MVP.
Примеры:
Извлечение структурированных сущностей из сканов с неструктурированными документами: запросы гос. органов, исполнительные листы, судебные приказы
Определение наличия печати и подписи на сканах
Разработка классификаторов на основе табличных / текстовых данных
Ранжирование обращений
Поиск аномалий и выбросов
Прогноз входящего потока заявок
Визуализация графов передвижения заявок по системам.
*
Требования
• Уверенное знание python и библиотек numpy, pandas, sklearn
• Опыт работы с dl фреймворками, например pytorch
• Хорошее владение библиотеками формирования эмбеддингов (word2vec, fasttext, ELMO, BERT, MUSE, doc2vec и др.). Умение производить дообучение
• Опыт решения практических NLP-задач для русского языка (NER, Text Classification, Summarization, Topic Modeling, Question Answering)
• Хорошее знание git, docker.

Будет плюсом:
• Опыт коммерческой разработки на python
• Опыт планирования архитектуры приложений и создания ml-сервисов
• Желание решать не только nlp, но и классические ml задачи
• Опыт работы в крупном банке.
Условия
Белая ЗП и приятные годовые бонусы
ДМС
Комфортный отдельный кабинет
Тренажерный зал и столовая в офисе
Поддерживаем саморазвитие. Оплачиваем курсы, книги, конференции.
Офис: Москва, м. Кожуховская. Full-time в офисе
Условия",0,https://rabota.sber.ru/search,0,2023-10-19
62,1,https://rabota.sber.ru/search/4224484,Java Developer,,,,,,0,https://rabota.sber.ru/search,0,2023-11-02
63,1,https://rabota.sber.ru/search/4225013,Java разработчик на 3-я линия,,,,,"Мы – команда разработки продукта Platform V Flow, позволяющего автоматизировать бизнес-процессы в бессерверном режиме, включая оркестрацию микросервисов и пользовательских задач. Вы создаёте BPMN2 процесс (XML файл), загружаете в облако и стартуете. Всё остальное SberFlow возьмёт на себя.Подробнее с нашим продуктом можно ознакомиться на сайте Platform V.

Важнейшим приоритетом в работе нашей команды является забота о пользователях. Сейчас продуктом Flow пользуются более 50 команд. А скоро их будет еще больше!

Мы ищем Java Engineer для поддержки и разработки новой функциональности компонентов продукта!
Обязанности
проектирование доработок в существующих и запускаемых с нуля продуктах
разработка новой и улучшение существующей функциональности
технологический анализ
сопровождение продуктов и устранение дефектов
внутреннее и внешнее тестирование, автоматизация тестов
выпуск в опытную и промышленную эксплуатацию
Требования
Spring Framework, Spring Boot, Spring Security/MVC/Actuator и т.д.
опыт работы с ORM
опыт работы с Apache Kafka
умение разбираться в чужом коде, писать чистый и понятный код для других разработчиков
умение проектировать и реализовавывать эффективные модульные тесты
способность оптимизировать свой собственный код и код других разработчиков
знание SQL, умение писать оптимальные запросы
способность учиться и осваивать новые технологии легко выходя из зоны комфорта
английский на уровне чтения технической документации

Будет плюсом:
опыт работы в Scrum команде
опыт работы с инструментами Jira, Confluence, Git, Jenkins, Sonar, Maven, Gradle, Nexus
опыт разработки по TDD
опыт работы с graphql или аналогами
знакомство с технологиями контейнеров и систем управления контейнерами (Docker, Kubernetes, Openshift)
понимание принципов работы и особенностей SQL, NoSQL и Hybrid SQL хранилищ
владение разными инструментами экосистемы Spring
знание фронтовых техник (ReactJS, TypeScript)
Условия
гибкий график работы: рабочие смены с 8 до 16 и с 16 до 00, 40 рабочих часов в неделю и плавающие выходные
официальное оформление с первого дня
стабильный оклад и социальная поддержка сотрудников
расширенный ДМС с первого дня работы для сотрудников и льготная медицинская страховка для близких
бесплатная подписка СберПрайм+, скидки на продукты компаний-партнеров
корпоративная пенсионная программа
корпоративное обучение за счет компании
реферальная программа для сотрудников: можно пригласить в команду знакомых профессионалов и получить вознаграждение
корпоративный спортзал
мощное железо, дополнительные мониторы и всё, что нужно для продуктивной работы",0,https://rabota.sber.ru/search,0,2023-11-02
64,1,https://rabota.sber.ru/search/4220872,Data Scientist (Middle\Middle+),,,,,"Юнит Data ПАО «Сбербанк» ищет Middle\Middle+ Data Scientist в команду Digital Avatar. Предстоит заниматься созданием и имплементацией в бизнес процессы SOTA подходов и алгоритмов, в том числе больших foundation моделей (BERT-like, GPT-like), аккумулирующих в себе большой объем данных о продуктах и клиентах, способных решать разные прикладные задачи бизнеса (recsys, campaign и др). Еще один важный трек работы - создание цифровых двойников клиентов, human behaviour modelling. Работа команды в стиле RnD for business: проводим эксперименты, выбираем наилучшее решение, доводим до бизнеса.
Обязанности
поиск новых AI подходов для решения бизнес-задач (технические статьи с arxiv.org, общение с бизнесом, исследование рынка)
проводить эксперименты: реализуем подход\модель - замеряем эффект
совместно с бизнесом проводить пилот на новой технологии.
Требования
знания Transformers (Encoder, Decoder, Encoder-Decoder), опыт тренировки embeddings, GPT-like, BERT-like моделей
умение читать научные статьи и реализовывать описанные в них алгоритмы
желание выдвигать гипотезы как улучшить процессы, общаться с бизнесом.

Будет плюсом:
знание специфики Campaign\Direct Marketing (как проводятся кампании продаж через смс\пуши\банеры
знания в области создания рекомендательных систем
умение работать с большими данными.
Условия
команда профессионалов, готовых поддержать ваши инициативы
возможность работы с новыми технологиями
обучение за счёт компании
красивый и комфортный офис по адресу г. Москва Кутузовский пр-т 32
ДМС
прозрачная система бонусов и премий, достойная зарплата — размер обсудим на собеседовании.",0,https://rabota.sber.ru/search,0,2023-11-08
